"","Products","Price","Ratings","Reviews"
"1","Palmolive Foaming Liquid Hand Wash Soap 3L (3 x 1L packs), Japanese Cherry Blossom Refill and Save, No Parabens Phthalates and Alcohol, Recyclable Bottle","$12.72","1,736","4.7 out of 5 stars"
"2","Mielle Rosemary Mint Scalp & Hair Strengthening Oil","$21.99","381","4.4 out of 5 stars"
"3","Dove Triple Moisturising Body Wash 1 L","$16.26","3,497","4.7 out of 5 stars"
"4","COSRX Snail Mucin 96% Power Repairing Essence 3.38 fl.oz 100ml, Hydrating Serum for Face with Snail Secretion Filtrate for Dull Skin & Fine Lines, Korean Skincare","$11.04","64,189","4.5 out of 5 stars"
"5","Neutrogena T/Gel Pleasant Fragrance Therapeutic Shampoo 200mL","$15.63","221","4.5 out of 5 stars"
"6","Palmolive Foaming Hand Wash Soap, 250mL, Japanese Cherry Blossom Pump, No Parabens Phthalates or Alcohol","$1.99","1,023","4.8 out of 5 stars"
"7","Johnson's Pure Cotton Bud Applicators With Paper Sticks 150 Pack","$4.99","1,327","4.5 out of 5 stars"
"8","Paula's Choice Skin Perfecting 2% BHA Liquid Salicylic Acid Exfoliant, Gentle Facial Exfoliator for Blackheads, Large Pores, Wrinkles & Fine Lines, Travel Size, 30 mL Bottle","$60.37","90,225","4.5 out of 5 stars"
"9","Palmolive Naturals Body Wash 3L (3x1L), Milk and Honey with Moisturizing Milk, Soap Free Shower Gel, No Parabens or Phthalates","$17.97","148","4.7 out of 5 stars"
"10","COSRX Snail 92% All in One Cream (100/200 g) (3.52 oz / 100 g)","$18.05","31,557","4.4 out of 5 stars"
