"","Products"
"1","Basesailor USB to USB C Adapter 2 Pack,USB C Female to A Male Charger Type C Converter for Apple Watch Ultra iWatch 7 8 SE,iPhone 15 14 13 12 Plus Pro Max Mini,AirPods,iPad Air,Samsung Galaxy S23 S22"
"2","Laser Clean Range Air Duster 400Ml for Computer Cleaning, PC, Laptop, Console, Electronics and Home Cleaning, Keyboard, Car"
"3","iPhone Fast Charger, 20W iPhone/iPad Charger Adapter with USB-C to Lightning Cable 1m, Aerostralia USB C Apple Charger Adapter with Lightning Cord Compatible with iPhone 14/13/12/11/X/9, iPad, Airpods"
"4","INIU USB C to USB C Cable 100W Fast Charger [2m+2m] PD 5A Type C to Type C Cables, Nylon Braided USB-C Phone Fast Charging for iPhone 15 Samsung S22 S23 Note 20 iPad Pro MacBook Laptop Tablet Google"
"5","UGREEN USB C Cable Type C to USB A Fast Charger Nylon Braided Cord Compatible with iPhone 15 Pro Max, Samsung Galaxy S22 S23 Note 20 10, LG G8 G7 V40, GoPro Hero, Switch, Motorola Moto, Nokia(0.5M)"
"6","USB C to Lightning Cable 3Pack 6FT [Apple MFi Certified] iPhone Fast Charger Cable USB-C Power Delivery Charging Cord Compatible with iPhone 14/13/12/11/XS/Max/XR/X/8/iPad, White"
"7","Logitech M185 Wireless Mouse, 2.4GHz with USB Mini Receiver, 12-Month Battery Life, 1000 DPI Optical Tracking, Ambidextrous PC/Mac/Laptop - Swift Gray"
"8","UGREEN SD Card Reader USB 3.0 Dual Slot Flash Memory Card Reader TF, SD, Micro SD, SDXC, SDHC, MMC, RS-MMC, Micro SDXC, Micro SDHC, UHS-I for Mac, Windows, Linux, Chrome, Read 2 Cards Simultaneously"
"9","UGREEN USB C Cable Type C to USB A Fast Charger Nylon Braided Cord Compatible with iPhone 15 Pro Max, Samsung Galaxy S22 S23 Note 20 10, LG G8 G7 V40, GoPro Hero, Switch, Motorola Moto, Nokia(1M)"
"10","iPhone Fast Chargers, [2-Pack] 20W iPhone/iPad Charger Adapter with USB-C to Lightning Cable 1m, USB C Apple Charger Adapter with Lightning Cord Compatible with iPhone 14/13/12/11/X/9/8, iPad, Airpod"
"11","Lightning Cable 2m 2pack, Aioneus iPhone Charging Cable MFi Certified USB A to Lightning Cable iPhone Charger Cable Fast Charging Compatible with iPhone 14 13 12 11 Pro Max Mini XS XR X 8 7 Plus iPad"
"12","Apple Lightning to SD & TF Card Dual Slot Reader for iPhone/iPad, 2 in 1 Micro SD TF Trail Camera Viewer Memory Card Adapter, Plug and Play"
"13","UGREEN USB C to USB Adapter 10Gbps, 2 Pack Type A Female to Type C Male Converter Thunderbolt 3 to USB 3.2 Gen 2 OTG Adaptor Compatible with MacBook Air iPad iPhone 15 Pro Max Galaxy S24 (Space Gray)"
"14","Syntech USB C to USB Adapter Pack of 2 USB C Male to USB3 Female Adapter Compatible with MacBook Pro 2023 iMac iPad Mini 6/Pro MacBook Air 2022 and Other Type C or Thunderbolt 4/3 Devices Space Grey"
"15","LISEN 240W USB C to USB C Cable [2M/2 Pack], PD3.1 Certified iPhone Charging Cable, USBC to USBC Cable for iPhone 15 Charger Cable/Pro/Plus/iPad Pro/Air/MacBook M3/2023, Type C Cord for Samsung S24"
"16","STORMHERO Desk Fan, Clip on Stroller Fan,Rechargeable USB Quiet Personal Fan, Strong Air 3-Speed Portable Fan, 2000mah Battery Clip Adjustable Fan Bedroom Outdoor Camping Golf Cart Home Office Black"
"17","Silkland 4K HDMI Cable 2M, [Gold Plated, HDR, ARC] High Speed HDMI 2.0 Cables 18Gbps, 4K 60hz, 2160p, 1440P, 3D, HDCP 2.2, Compatible with Roku TV, Xbox One, PS4, PS5, Laptop, Monitor"
"18","USB C Hub, NOVOO USB Type C Hub Adapter with 4K HDMI, 2 X USB 3.0, SD Card & Micro SD Card Slots USB-C Multiport Adapter USB C Dongle for MacBook Pro Dell XPS HP More Type C Devices"
"19","Logitech MX Master 3S - Wireless Performance Mouse with Ultra-Fast Scrolling, Ergo, 8K DPI, Track on Glass, Quiet Clicks, USB-C, Bluetooth, Windows, Linux, Chrome"
"20","UGREEN USB C to USB C Cable 100W Type C Charger Cable Power Delivery PD Charging Cord for iPhone 15 Pro Max, MacBook Pro, iPad Pro, Dell XPS, Chromebook, Pixel 7, Samsung S23 S22, Switch (2M, Black)"
"21","INPHIC Bluetooth Mouse, [Upgraded] Multi-Device Silent Rechargeable Bluetooth Wireless Mouse (Tri-Mode: BT 5.0/4.0+2.4G), 1600DPI Ergonomic Portable Mouse for Laptop PC Computer Mac, Black"
"22","JSAUX USB C to HDMI Adapter, 4K Type C to HDMI Female Adapter [Thunderbolt 3/4 Compatible] HDMI to USBC Adapter for iPhone 15 Pro/Max/Plus, MacBook Dell XPS TV Surface Samsung S23 S22 S21 Ultra-Grey"
"23","Extended Gaming Mouse Pad with Stitched Edges, Amazer-T Large Mousepad with Premium-Textured Cloth, Non-Slip Rubber Base, Waterproof Keyboard Pad, Mouse Mat for Gaming and Working - 80x30cm (31.5x11.8in)"
"24","sweguard USB Type C Charger Cable [2M,2-Pack] iPhone 15 Charger Cable Nylon Braided for iPhone 15 Pro Max Plus, Samsung Galaxy S24 S23 S22 Ultra S21 S20 S10 S9 S8 Note 20 10 Flip Pixel LG Moto Sony"
"25","Boreguse iPhone Charger Lightning Cable 3 Pack 3FT, [Apple MFi Certified] for Apple Charger Cable USB to Lightning Cable Fast Charging, Nylon Braided iPhone Charger Cord"
"26","Beikell SD Card Reader, Dual Plug USB 3.0/USB C Card Reader High Speed OTG Adapter, for SD/MMC/Micro SD/TF/SDXC/SDHC/Micro SDHC/Micro SDXC, Compatible with Android/Windows/Mac OS etc."
"27","HDMI Cable 2M,4K HDMI Cable Snowkids (18Gbps 4K 60Hz 3D Support, Ethernet Function,Video 4K UHD 2160p,HD 1080p for Fire TV,for ps3/4,ect)"
"28","UGREEN 2 Pack USB C to USB C Charger Cable, Type C 100W PD Fast Charging Cord Compatible with iPhone 15 Pro Max, MacBook Pro, iPad Pro, Dell, Matebook, Chromebook, Pixel, Samsung S23 S22, Switch, 1M"
"29","UGREEN USB C Cable Type C to USB A Fast Charger Nylon Braided Cord Compatible with iPhone 15 Pro Max, Samsung Galaxy S22 S23 Note 20 10, LG G8 G7 V40, GoPro Hero, Switch, Motorola Moto, Nokia(2M)"
"30",NA
"31","BrexLink USB C Cable, 2Pack 2M USB Type C to USB A Fast Charger Nylon Braided Cord for iPhone 15 Pro, Samsung S22 S21, Note 20 10, Pixel, LG G8 7 V 40, Switch Android Auto (6.6ft/ Grey)"
"32","[2 Pack] ProCase iPad 10.2 9th Gen 2021/ 8th 2020/ 7th 2019 Screen Protector, Tempered Glass Screen Film Guard for 10.2"" A2602/A2603/ A2270/A2428/ A2197/A2198 -Clear"
"33","JETech Screen Protector for iPad 10 (10.9-Inch, 2022 Model, 10th Generation), 9H Tempered Glass Film, HD Clear, 2-Pack"
"34","Logitech G733 LIGHTSPEED Wireless Gaming Headset with suspension headband, LIGHTSYNC RGB, Blue VO!CE mic technology and PRO-G audio drivers - Black"
"35","2 PACK Paperfeel Screen Protector for iPad Pro 11 inch 2022-2018, for iPad Air 5th/4th Generation 10.9 inch, XIRON Matte PET Film for iPad Air 5/4, Write and Draw Like on Paper, Anti-Glare Screen Protector"
"36","UGREEN USB C Cable Type C to USB A Fast Charger Nylon Braided Cord Compatible with Samsung Galaxy S9 S10 S20 S21 S22 Note 20 10 9, LG G8 G7 V40, GoPro Hero 7 6 5, Switch, Motorola Moto, Nokia (3M)"
"37","USB C to Lightning Cable 3M 2Pack, Extra Long iPhone Charger Cable Apple MFi Certified Power USB-C iPhone Charger Cord Fast Charging for iPhone 14 13 12 11 Pro Max Mini XS XR X 8 7 Plus 6s SE, iPad"
"38","Elebase USB to USB C Adapter 4 Pack,Type C Female to A Male Charger Converter for Apple Watch Ultra iWatch 7 8 SE,iPhone 15 14 13 12 Pro Max Mini,Airpods,iPad 8 9 Air 5,Galaxy Note 10 20 S23 S21 S22"
"39","Silkland USB C to USB C Cable 60W Fast Charging 3 Pack [2m+1m+0.5m], PD QC 3.0, Type C to Type C Charger USBC Cord Compatible for iPhone 15, Samsung S23 S22 Note 20 Ultra, iPad, MacBook, Google Pixel"
"40","Xiaomi MI-BHR4838GL Motion Monitor Light bar, Black"
"41","Apple Lightning to USB Cable (1m)"
"42","USB C Hub NOVOO 6-in-1 Type C Hub with 4K HDMI, 100W Power Delivery, 2 USB 3.0 Ports, SD/TF Card Reader USB C Adapter Dock for MacBook Air/Pro/Chromebook/Type C Laptops"
"43","ProCase iPad 10.2 Case 9th Gen 2021/ iPad 8th Gen 2020/ 7th Gen 2019, Slim Stand Hard Back Shell Protective Smart Cover Case for 10.2 Inch iPad 9/8/7 -Navy"
"44","USB C to Lightning Cable, 3Pack 1M iPhone Fast Charger Cable [MFi Certified], Type C to iPhone Charging Cord for iPhone 14 13 12 Mini Pro Max 11 X XS XR 8 Plus iPad AirPods Pro, White"
"45","UGREEN USB C to USB C Cable 100W Type C Charger Cable Power Delivery PD Charging Cord for iPhone 15 Pro Max, MacBook Pro, iPad Pro, Dell XPS, Chromebook, Pixel 7, Samsung S23 S22, Switch (1M, Black)"
"46","UGREEN Revodok 105 USB C Hub 5 in 1 Multiport Adapter 4K HDMI, 100W Power Delivery, 3 USB-A Data Ports, USB C Dongle for MacBook Pro/Air, iPad Pro, iMac, iPhone 15 Pro/Pro Max, XPS, Thinkpad"
"47","USB Hub, VIENON 4-Port USB 3.0 Hub USB Splitter USB Expander for Laptop, Xbox, Flash Drive, HDD, Console, Printer, Camera,Keyborad, Mouse- Black/USB Port"
"48","4K DisplayPort to HDMI Cable Adapter 2M, JSAUX DP to HDMI Male Video UHD 1440P/2K@120Hz,4K@30 Nylon DP to HDTV Uni-Directional Cord for Dell, Projector, Desktop, AMD, NVIDIA, Lenovo, HP, ThinkPad"
"49","UGREEN USB C to USB Adapter OTG Cable Type C Male to Type A Female Adaptor USB-C to USB 3.0 Converter Compatible with Thunderbolt 3 MacBook, iMac, iPad Pro/Air/Mini, iPhone 15 Plus/Pro Max, Galaxy S23"
"50","Logitech G PRO X Superlight 2 Lightspeed Wireless Gaming Mouse, Lightweight, LIGHTFORCE Hybrid Switches, Hero 2 Sensor, 32,000 DPI, 5 Programmable Buttons, USB-C Charging, PC & Mac - Black"
"51","1080P Webcam,Live Streaming Web Camera with Stereo Microphone, Desktop or Laptop USB Webcam with 110 Degree View Angle, HD N5 Webcam for Video Calling, Recording, Conferencing, Streaming, Gaming"
"52","sisma Travel Electronics Organiser Carrying Case for Power Cords Power Bank Earbuds Hard Drives Memory Cards Laptop Adapter Mouse Small Accessories -Grey 1680D Fabrics SCB17092B"
"53","JETech 2-Pack Screen Protector for iPad Air 5/4 10.9-Inch, iPad Pro 11-Inch All Models, Face ID Compatible, Tempered Glass Film"
"54","HEYMIX 65W Laptop Charger for Microsoft Surface Pro 9, 8, 7+, 7, 6, 5, 4, 3, X, Power Supply Laptop Charger for Windows Surface 5, 4, 3, 2, 1 Studio, Support 44W&36W&24W, 10ft Power Cord"
"55","USB C Docking Station Dual Monitor, 9 in 1 USB C Triple Display Docking Station to Dual HDMI Adapter Displayport SD TF Card Reader 2USB 2.0, 1 USB 3.0, 100W PD for USB C Thunderbolt 3 Laptops"
"56","GTGUGR 2m Universal Adapter Power Supply 30W AU 2A,100-240V to 3V,4.5V,5V,6V,7.5V,9V,12V,Adjustable DC Charger Adapter for Routers,LED Lighting,Cameras,Surveillance Equipment.(8 Selectable Interfaces)"
"57","Silkland [VESA Certified] DisplayPort Cable 2M, DP Cable [4K@60Hz, 2K@165Hz 144Hz, 1080P@240Hz], Braided Video Display Port Cord 1440P High Speed Compatible for FreeSync G-Sync Gaming Monitor"
"58","ROMOSS 3 in 1 Multi Charging Cable, 3.3ft/1m Universal USB C Cable Fast Charging Cord, USB to USB C/Micro USB/Lighting Cable for iPhone, Tablets, Galaxy, Google Pixel, LG and More(1 Pack)"
"59","Active Stylus Pen Compatible for iOS&Android Touch Screens, Pencil for iPad with Dual Touch Function,Rechargeable Stylus for iPad/iPad Pro/Air/Mini/iPhone/Cellphone/Samsung/Tablet Drawing&Writing"
"60","UGREEN USB Extension Cable USB 3.0 Extender Type A Male to Female Cord High Speed Data Transfer Lead Compatible with Webcam, Gamepad, USB Keyboard, Mouse, Flash Drive, Hard Drive, Oculus VR, Xbox (1M)"
"61","Logitech G733 LIGHTSPEED Wireless Gaming Headset with suspension headband, LIGHTSYNC RGB, Blue VO!CE mic technology and PRO-G audio drivers - Black"
"62","1080P Webcam,Live Streaming Web Camera with Stereo Microphone, Desktop or Laptop USB Webcam with 110 Degree View Angle, HD N5 Webcam for Video Calling, Recording, Conferencing, Streaming, Gaming"
"63","1080P Webcam with Microphone, EMEET C960 Web Camera, 2 Mics Streaming Webcam with Privacy Cover, 90°View Computer Camera, Plug&Play USB Webcam for Calls/Conference, Zoom/Skype/YouTube, Laptop/Desktop"
"64","HyperX Cloud II – Gaming Headset for PC, PS5 / PS4. Includes 7.1 virtual surround sound and USB audio control box - Red"
"65","Logitech z150 Multimedia Speakers"
"66","Webcam HD 1080p Web Camera, USB PC Computer Webcam with Microphone, Laptop Desktop Full HD Camera Video Webcam 110 Degree Widescreen, Pro Streaming Webcam for Recording, Calling, Conferencing, Gaming"
"67","HyperX Cloud Alpha Wireless Gaming Headset, Black, Red, Large"
"68","Creative Pebble 2.0 USB Desktop Speakers,Black,51MF1680AA000"
"69","Logitech G733 LIGHTSPEED Wireless Gaming Headset with suspension headband, LIGHTSYNC RGB, Blue VO!CE mic technology and PRO-G audio drivers - White"
"70","Logitech G PRO X 2 Lightspeed Wireless Gaming Headset, Detachable Boom Mic, 50mm Graphene Drivers, DTS:X Headphone 2.0—7.1 Surround, Bluetooth/USB/3.5mm Aux, for PC, PS5, PS4, Nintendo Switch - Black"
"71","Razer RZ04-03240100-R3M1 BlackShark V2 X Wired Gaming Headset, Black"
"72","Shenzhi Tech Wireless Lavalier Microphone for USB C Smartphone, Plug and Play Mini Mic for YouTube TikTok Live Streaming Gaming Recording Auto Noise Reduction (USB C 2)"
"73","Logitech H390 USB Computer Headset"
"74","Logitech G435 Lightspeed Wireless Gaming Headset, Black"
"75","Computer Speakers,Smalodi PC Speaker Mini Led Soundbar Cool Design Perfect for Gaming Laptop Desktop Notebook"
"76","Full HD Webcam 1080p Computer Webcam with Microphone USB PC HD Camera Video Call Recording Webcam Video Conference Call and Live Broadcast Game Online Course Remote Laptop Desktop with Privacy Cover"
"77","EMEET C960 4K Webcam for PC, 4K UHD Sony Sensor, TOF Auto Focus, Dual AI Noise-Cancelling Mics, Auto Light Correction, 66° FOV, Plug&Play Webcam with Privacy Cover, Works with Zoom/Teams/Skype/Google"
"78","Logitech HD Pro Webcam C920"
"79","Edifier K800 USB Computer Headset with Microphone – Noise Cancelling Microphone Rotates 120 Degrees for Clear Voice Pick, Adjustable Microphone, Ideal for Office, Education"
"80","Elgato Facecam - 1080p60 Full HD Webcam for Video Conferencing, Gaming, Streaming, Sony Sensor, Fixed-Focus Glass Lens, Optimized for Indoor Lighting, Onboard Memory, works with Zoom, Teams, PC/Mac"
"81","Logitech C922 Pro Stream Webcam 1080P Camera for HD Video Streaming & Recording 720P at 60Fps with Tripod Included"
"82","Creative Pebble 2.0 USB Desktop Speakers,White,51MF1680AA001"
"83","Redragon GS560 Adiemus RGB Desktop Soundbar, 2.0 Channel Computer Speaker with Dynamic Lighting Bar Audio-Light Sync/Display, Touch-Control Backlit with Volume Knob, USB Powered w/ 3.5mm Cable"
"84","Logitech C920 HD Pro Webcam, Full HD 1080p/30fps Video Calling, Clear Stereo Audio, HD Light Correction, Works with Skype, Zoom, FaceTime, Hangouts, PC/Mac/Laptop/MacBook/Tablet - Black"
"85","CORSAIR HS60 HAPTIC Stereo Gaming Headset with Haptic Bass (Haptic Bass Powered by Taction Technology, Plush Memory Foam Ear Cups, Custom-Tuned 50mm Neodymium Audio, Detachable Microphone) Carbon"
"86","Edifier MR4 Powered Studio Monitor Speakers, 4"" Active Near-Field Monitor Speaker - White (Pair)"
"87","SoundPEATS A7 Pro Bluetooth Headset with Microphone V5.2, AI Noise Cancellation Wireless Headset with Mute Mode, 40 hrs Talktime Headset for PC/Gaming/Call Center/Meeting/Office- Black"
"88","ECSiNG 3.5mm Replacement Microphone 19cm Reduce Noise Detachable Compatible with SteelSeries Arctis 1 Wired Wireless Gaming Headset Black with Foam Cover"
"89","Logitech HD Webcam C270"
"90","Mini USB Microphone for Laptop and Desktop Computer, with Gooseneck & Universal USB Sound Card, Compatible with PC and Mac, Plug & Play, Ideal Condenser Mic for Remote Work, Online Class, CGS-M1"
"91","Logitech z150 Multimedia Speakers"
"92","Creative Pebble 2.0 USB Desktop Speakers,Black,51MF1680AA000"
"93","Computer Speakers,Smalodi PC Speaker Mini Led Soundbar Cool Design Perfect for Gaming Laptop Desktop Notebook"
"94","Creative Pebble 2.0 USB Desktop Speakers,White,51MF1680AA001"
"95","Redragon GS560 Adiemus RGB Desktop Soundbar, 2.0 Channel Computer Speaker with Dynamic Lighting Bar Audio-Light Sync/Display, Touch-Control Backlit with Volume Knob, USB Powered w/ 3.5mm Cable"
"96","Edifier MR4 Powered Studio Monitor Speakers, 4"" Active Near-Field Monitor Speaker - White (Pair)"
"97","Edifier G2000 32W Computer Speaker, PC Gaming Speaker for Desktop with Subout Port, Hi-Fi Sound, EQ Mode, Bluetooth 5.1, USB, 3.5mm Aux Inputs, RGB Lights - Black"
"98","Logitech Z407 Bluetooth Computer Speakers with Subwoofer and Wireless Control"
"99","Creative Pebble V3 Minimalistic 2.0 USB-C Desktop Speakers with USB Audio, Clear Dialog Enhancement, Bluetooth 5.0, 8W RMS with 16W Peak Power, USB-A Converter Included (Black)"
"100","Computer Speakers,Smalody PC Speaker Mini Led Soundbar Cool Design Perfect for Monitor Gaming Laptop Desktop Notebook"
