"","Title","Author","Subject","Abstract","Meta"
"1","Spline Trajectory Tracking and Obstacle Avoidance for Mobile Agents via Convex Optimization","Akua Dickson, Christos G. Cassandras, Roberto Tron","Systems and Control (eess.SY)","We propose an output feedback control-based motion planning technique for agents to enable them to converge to a specified polynomial trajectory while imposing a set of safety constraints on our controller to avoid collisions within the free configuration space (polygonal environment). To achieve this, we 1) decompose our polygonal environment into different overlapping cells 2) write out our polynomial trajectories as the output of a reference dynamical system with given initial conditions 3) formulate convergence and safety constraints as Linear Matrix Inequalities (LMIs) on our controller using Control Lyapunov Functions (CLFs) and Control Barrier Functions (CBFs) and 4) solve a semi-definite programming (SDP) problem with convergence and safety constraints imposed to synthesize a controller for each convex cell. Extensive simulations are included to test our motion planning method under different initial conditions and different reference trajectories. The synthesized controller is robust to changes in initial conditions and is always safe relative to the boundaries of the polygonal environment.","Mon, 25 Mar 2024 16:11:29 UTC (234 KB)"
"2","Bi-objective Optimization in Role Mining","Jason Crampton, Eduard Eiben, Gregory Gutin, Daniel Karapetyan, Diptapriyo Majumdar","Cryptography and Security (cs.CR)","Role mining is a technique used to derive a role-based authorization policy from an existing policy. Given a set of users $U$, a set of permissions $P$ and a user-permission authorization relation $\mahtit{UPA}\subseteq U\times P$, a role mining algorithm seeks to compute a set of roles $R$, a user-role authorization relation $\mathit{UA}\subseteq U\times R$ and a permission-role authorization relation $\mathit{PA}\subseteq R\times P$, such that the composition of $\mathit{UA}$ and $\mathit{PA}$ is close (in some appropriate sense) to $\mathit{UPA}$.
In this paper, we first introduce the Generalized Noise Role Mining problem (GNRM) -- a generalization of the MinNoise Role Mining problem -- which we believe has considerable practical relevance. Extending work of Fomin et al., we show that GNRM is fixed parameter tractable, with parameter $r + k$, where $r$ is the number of roles in the solution and $k$ is the number of discrepancies between $\mathit{UPA}$ and the relation defined by the composition of $\mathit{UA}$ and $\mathit{PA}$. We further introduce a bi-objective optimization variant of GNRM, where we wish to minimize both $r$ and $k$ subject to upper bounds $r\le \bar{r}$ and $k\le \bar{k}$, where $\bar{r}$ and $\bar{k}$ are constants. We show that the Pareto front of this bi-objective optimization problem (BO-GNRM) can be computed in fixed-parameter tractable time with parameter $\bar{r}+\bar{k}$.
We then report the results of our experimental work using the integer programming solver Gurobi to solve instances of BO-GNRM. Our key findings are that (a) we obtained strong support that Gurobi's performance is fixed-parameter tractable, (b) our results suggest that our techniques may be useful for role mining in practice, based on our experiments in the context of three well-known real-world authorization policies.","Mon, 25 Mar 2024 13:36:20 UTC (58 KB)"
"3","Power-Aware Sparse Reflect Beamforming in Active RIS-aided Interference Channels","Ruizhe Long, Hu Zhou, Ying-Chang Liang","Information Theory (cs.IT)","Active reconfigurable intelligent surface (RIS) has attracted significant attention in wireless communications, due to its reflecting elements (REs) capable of reflecting incident signals with not only phase shifts but also amplitude amplifications. In this paper, we are interested in active RIS-aided interference channels in which $K$ user pairs share the same time and frequency resources with the aid of active RIS. Thanks to the promising amplitude amplification capability, activating a moderate number of REs, rather than all of them, is sufficient for the active RIS to mitigate cross-channel interferences. Motivated by this, we propose a power-aware sparse reflect beamforming design for the active RIS-aided interference channels, which allows the active RIS to flexibly adjust the number of activated REs for the sake of reducing hardware and power costs. Specifically, we establish the power consumption model in which only those activated REs consume the biasing and operation power that supports the amplitude amplification, yielding an $\ell_0$-norm power consumption function. Based on the proposed model, we investigate a sum-rate maximization problem and an active RIS power minimization problem by carefully designing the sparse reflect beamforming vector. To solve these problems, we first replace the nonconvex $\ell_0$-norm function with an iterative reweighted $\ell_1$-norm function. Then, fractional programming is used to solve the sum-rate maximization, while semidefinite programming together with the difference-of-convex algorithm (DCA) is used to solve the active RIS power minimization. Numerical results show that the proposed sparse designs can notably increase the sum rate of user pairs and decrease the power consumption of active RIS in interference channels.","Mon, 25 Mar 2024 06:56:27 UTC (1,094 KB)"
"4","A Monte Carlo Simulation of the Broad Band X-ray Emission of the Accreting Millisecond X-ray pulsar MAXI J1816-195","Yuan You (1), Shuang-Nan Zhang (1), Zhaosheng Li (2), Mingyu Ge (1) ((1) Key Laboratory of Particle Astrophysics, Institute of High Energy Physics, Chinese Academy of Sciences, Beijing, China, (2) Key Laboratory of Stars and Interstellar Medium, Xiangtan University, Xiangtan University, Xiangtan, Hunan, China)","High Energy Astrophysical Phenomena (astro-ph.HE)","MAXI J1816-195 is an accreting millisecond X-ray pulsar (AMXP) discovered in 2022. According to the Insight-HXMT data, the pulsations of this source extend all the way to over 100 keV, and its pulse profiles change from a single peak in low-energy range to double peaks in high-energy range. In this work, we simulate its energy spectra and pulse profiles with a Compton scattering Monte Carlo program. The simulation results suggest that the low energy X-ray source on the neutron star surface should be pencil-beamed radiations from the magnetic poles, and there should be a boundary layer in a hollow cylinder shape between the accretion disc and the neutron star surface: the up-scattering of the polar radiations in the boundary layer leads to the double peak structure of the high-energy pulse profile. Under this boundary layer geometry, we suggest that the rarity of AMXPs can be caused by the smearing of the boundary layer. To estimate the mass M and radius R of accretion-powered millisecond pulsars whose surface radiations are badly polluted by the accretion disk and boundary layer, the impact of Compton scattering in the boundary layer on the radiation should be removed before employing the X-ray pulse profile modeling method.","Mon, 25 Mar 2024 02:39:12 UTC (21,901 KB)"
"5","Percentile Optimization in Wireless Networks- Part I: Power Control for Max-Min-Rate to Sum-Rate Maximization (and Everything in Between)","Ahmad Ali Khan, Raviraj Adve","Information Theory (cs.IT)","Improving throughput for cell-edge users through coordinated resource allocation has been a long-standing driver of research in wireless cellular networks. While a variety of wireless resource management problems focus on sum utility, max-min utility and proportional fair utility, these formulations do not explicitly cater to cell-edge users and can, in fact, be disadvantageous to them. In this two-part paper series, we introduce a new class of optimization problems called percentile programs, which allow us to explicitly formulate problems that target lower-percentile throughput optimization for cell-edge users. Part I focuses on the class of least-percentile throughput maximization through power control. This class subsumes the well-known max-min and max-sum-rate optimization problems as special cases. Apart from these two extremes, we show that least-percentile rate programs are non-convex, non-smooth and strongly NP-hard in general for multiuser interference networks, making optimization extremely challenging. We propose cyclic maximization algorithms that transform the original problems into equivalent block-concave forms, thereby enabling guaranteed convergence to stationary points. Comparisons with state-of-the-art optimization algorithms such as successive convex approximation and sequential quadratic programming reveal that our proposed algorithms achieve superior performance while computing solutions orders of magnitude faster.","Mon, 25 Mar 2024 00:42:50 UTC (2,404 KB)"
"6","Safe Reinforcement Learning for Constrained Markov Decision Processes with Stochastic Stopping Time","Abhijit Mazumdar, Rafal Wisniewski, Manuela L. Bujorianu","Machine Learning (cs.LG)","In this paper, we present an online reinforcement learning algorithm for constrained Markov decision processes with a safety constraint. Despite the necessary attention of the scientific community, considering stochastic stopping time, the problem of learning optimal policy without violating safety constraints during the learning phase is yet to be addressed. To this end, we propose an algorithm based on linear programming that does not require a process model. We show that the learned policy is safe with high confidence. We also propose a method to compute a safe baseline policy, which is central in developing algorithms that do not violate the safety constraints. Finally, we provide simulation results to show the efficacy of the proposed algorithm. Further, we demonstrate that efficient exploration can be achieved by defining a subset of the state-space called proxy set.","Sat, 23 Mar 2024 20:22:30 UTC (1,449 KB)"
"7","Operational Experience and R&D results using the Google Cloud for High Energy Physics in the ATLAS experiment","Fernando Barreiro Megino, Kaushik De, Johannes Elmsheuser, Alexei Klimentov, Mario Lassnig, Miles Euell, Nikolai Hartmann, Tadashi Maeno, Verena Martinez Outschoorn, Jay Ajitbhai Sandesara, Dustin Sell","High Energy Physics - Experiment (hep-ex)","The ATLAS experiment at CERN relies on a worldwide distributed computing Grid infrastructure to support its physics program at the Large Hadron Collider. ATLAS has integrated cloud computing resources to complement its Grid infrastructure and conducted an R&D program on Google Cloud Platform. These initiatives leverage key features of commercial cloud providers: lightweight configuration and operation, elasticity and availability of diverse infrastructure. This paper examines the seamless integration of cloud computing services as a conventional Grid site within the ATLAS workflow management and data management systems, while also offering new setups for interactive, parallel analysis. It underscores pivotal results that enhance the on-site computing model and outlines several R&D projects that have benefited from large-scale, elastic resource provisioning models. Furthermore, this study discusses the impact of cloud-enabled R\&D projects in three domains: accelerators and AI/ML, ARM CPUs and columnar data analysis techniques.","Sat, 23 Mar 2024 15:44:29 UTC (2,067 KB)"
"8","Energy Efficient Design of Active STAR-RIS-Aided SWIPT Systems","Sajad Faramarzi, Hosein Zarini, Sepideh Javadi, Mohammad Robat Mili, Rui Zhang, George K. Karagiannidis, Naofal Al-Dhahir","Information Theory (cs.IT)","In this paper, we consider the downlink transmission of a multi-antenna base station (BS) supported by an active simultaneously transmitting and reconfigurable intelligent surface (STAR-RIS) to serve single-antenna users via simultaneous wireless information and power transfer (SWIPT). In this context, we formulate an energy efficiency maximisation problem that jointly optimises the gain, element selection and phase shift matrices of the active STAR-RIS, the transmit beamforming of the BS and the power splitting ratio of the users. With respect to the highly coupled and non-convex form of this problem, an alternating optimisation solution approach is proposed, using tools from convex optimisation and reinforcement learning. Specifically, semi-definite relaxation (SDR), difference of concave functions (DC), and fractional programming techniques are employed to transform the non-convex optimisation problem into a convex form for optimising the BS beamforming vector and the power splitting ratio of the SWIPT. Then, by integrating meta-learning with the modified deep deterministic policy gradient (DDPG) and soft actor-critical (SAC) methods, a combinatorial reinforcement learning network is developed to optimise the element selection, gain and phase shift matrices of the active STAR-RIS. Our simulations show the effectiveness of the proposed resource allocation scheme. Furthermore, our proposed active STAR-RIS-based SWIPT system outperforms its passive counterpart by 57% on average.","Sat, 23 Mar 2024 07:49:05 UTC (1,156 KB)"
"9","CodeShell Technical Report","Rui Xie, Zhengran Zeng, Zhuohao Yu, Chang Gao, Shikun Zhang, Wei Ye","Software Engineering (cs.SE)","Code large language models mark a pivotal breakthrough in artificial intelligence. They are specifically crafted to understand and generate programming languages, significantly boosting the efficiency of coding development workflows. In this technical report, we present CodeShell-Base, a seven billion-parameter foundation model with 8K context length, showcasing exceptional proficiency in code comprehension. By incorporating Grouped-Query Attention and Rotary Positional Embedding into GPT-2, CodeShell-Base integrates the structural merits of StarCoder and CodeLlama and forms its unique architectural design. We then carefully built a comprehensive data pre-processing process, including similar data deduplication, perplexity-based data filtering, and model-based data filtering. Through this process, We have curated 100 billion high-quality pre-training data from GitHub. Benefiting from the high-quality data, CodeShell-Base outperforms CodeLlama in Humaneval after training on just 500 billion tokens (5 epochs). We have conducted extensive experiments across multiple language datasets, including Python, Java, and C++, and the results indicate that our model possesses robust foundational capabilities in code comprehension and generation.","Sat, 23 Mar 2024 07:29:41 UTC (387 KB)"
"10","AC4: Algebraic Computation Checker for Circuit Constraints in ZKPs","Hao Chen, Minyu Chen, Ruibang Liu, Guoqiang Li","Software Engineering (cs.SE)","ZKP systems have surged attention and held a fundamental role in contemporary cryptography. Zk-SNARK protocols dominate the ZKP usage, often implemented through arithmetic circuit programming paradigm. However, underconstrained or overconstrained circuits may lead to bugs. Underconstrained circuits refer to circuits that lack the necessary constraints, resulting in unexpected solutions in the circuit and causing the verifier to accept a bogus witness. Overconstrained circuits refer to circuits that are constrained excessively, resulting in the circuit lacking necessary solutions and causing the verifier to accept no witness, rendering the circuit meaningless. This paper introduces a novel approach for pinpointing two distinct types of bugs in ZKP circuits. The method involves encoding the arithmetic circuit constraints to polynomial equation systems and solving polynomial equation systems over a finite field by algebraic computation. The classification of verification results is refined, greatly enhancing the expressive power of the system. We proposed a tool, AC4, to represent the implementation of this method. Experiments demonstrate that AC4 represents a substantial 29% increase in the checked ratio compared to prior work. Within a solvable range, the checking time of AC4 has also exhibited noticeable improvement, demonstrating a magnitude increase compared to previous efforts.","Sat, 23 Mar 2024 01:44:57 UTC (851 KB)"
"11","(Towards a) Statistical Probabilistic Lazy Lambda Calculus","Radha Jagadeesan","Logic in Computer Science (cs.LO)","We study the desiderata on a model for statistical probabilistic programming languages. We argue that they can be met by a combination of traditional tools, namely open bisimulation and probabilistic simulation.","Fri, 22 Mar 2024 18:51:53 UTC (71 KB)"
"12","Programmers Prefer Individually Assigned Tasks vs. Shared Responsibility","Adela Krylova, Roman Makarov, Sergei Pasynkov, Yegor Bugayenko","Software Engineering (cs.SE)","In traditional management, tasks are typically assigned to individuals, with each worker taking full responsibility for the success or failure of a task. In contrast, modern Agile, Lean, and eXtreme Programming practices advocate for shared responsibility, where an entire group is accountable for the outcome of a project or task. Despite numerous studies in other domains, the preferences of programmers have not been thoroughly analyzed. To address this gap, we conducted a survey featuring seven situational questions and collected the opinions of 120 software development practitioners. Our findings reveal that programmers prefer tasks to be assigned to them on an individual basis and appreciate taking personal responsibility for failures, as well as receiving individual rewards for successes. Understanding these preferences is crucial for project managers aiming to optimize team dynamics and ensure the successful completion of software projects.","Fri, 22 Mar 2024 08:10:15 UTC (28 KB)"
"13","Real-time Safety Index Adaptation for Parameter-varying Systems via Determinant Gradient Ascend","Rui Chen, Weiye Zhao, Ruixuan Liu, Weiyang Zhang, Changliu Liu","Systems and Control (eess.SY)","Safety Index Synthesis (SIS) is critical for deriving safe control laws. Recent works propose to synthesize a safety index (SI) via nonlinear programming and derive a safe control law such that the system 1) achieves forward invariant (FI) with some safe set and 2) guarantees finite time convergence (FTC) to that safe set. However, real-world system dynamics can vary during run-time, making the control law infeasible and invalidating the initial SI. Since the full SIS nonlinear programming is computationally expensive, it is infeasible to re-synthesize the SI each time the dynamics are perturbed. To address that, this paper proposes an efficient approach to adapting the SI to varying system dynamics and maintaining the feasibility of the safe control law. The proposed method leverages determinant gradient ascend and derives a closed-form update to safety index parameters, enabling real-time adaptation performance. A numerical study validates the effectiveness of our approach.","Fri, 22 Mar 2024 05:49:52 UTC (655 KB)"
"14","Fat API bindings of C++ objects into scripting languages","Russell K. Standish","Programming Languages (cs.PL)","A fat API exposes nearly all of a C++ object's public attributes and methods to a consuming environment, such as a scripting language, or web client. This can be contrasted with a conventional, or thin API, where the API is defined up front, and the C++ object provides the implementation, most of which is private to the C++ layer. Obviously, reflection is required to expose C++ objects to a consuming layer like this -- this paper explores using the Classdesc system to implement reflection of C++ objects into a JavaScript/TypeScript environment via a RESTservice, and also via a Node.js API module.","Fri, 22 Mar 2024 04:16:42 UTC (65 KB)"
"15","A Survey of Neural Code Intelligence: Paradigms, Advances and Beyond","Qiushi Sun, Zhirui Chen, Fangzhi Xu, Kanzhi Cheng, Chang Ma, Zhangyue Yin, Jianing Wang, Chengcheng Han, Renyu Zhu, Shuai Yuan, Qipeng Guo, Xipeng Qiu, Pengcheng Yin, Xiaoli Li, Fei Yuan, Lingpeng Kong, Xiang Li, Zhiyong Wu","Software Engineering (cs.SE)","Neural Code Intelligence -- leveraging deep learning to understand, generate, and optimize code -- holds immense potential for transformative impacts on the whole society. Bridging the gap between Natural Language and Programming Language, this domain has drawn significant attention from researchers in both research communities over the past few years. This survey presents a systematic and chronological review of the advancements in code intelligence, encompassing over 50 representative models and their variants, more than 20 categories of tasks, and an extensive coverage of over 680 related works. We follow the historical progression to trace the paradigm shifts across different research phases (e.g., from modeling code with recurrent neural networks to the era of Large Language Models). Concurrently, we highlight the major technical transitions in models, tasks, and evaluations spanning through different stages. For applications, we also observe a co-evolving shift. It spans from initial endeavors to tackling specific scenarios, through exploring a diverse array of tasks during its rapid expansion, to currently focusing on tackling increasingly complex and varied real-world challenges. Building on our examination of the developmental trajectories, we further investigate the emerging synergies between code intelligence and broader machine intelligence, uncovering new cross-domain opportunities and illustrating the substantial influence of code intelligence across various domains. Finally, we delve into both the opportunities and challenges associated with this field, alongside elucidating our insights on the most promising research directions. An ongoing, dynamically updated project and resources associated with this survey have been released at this https URL.","Thu, 21 Mar 2024 08:54:56 UTC (2,212 KB)"
"16","Personalized Programming Guidance based on Deep Programming Learning Style Capturing","Yingfan Liu, Renyu Zhu, Ming Gao","Computers and Society (cs.CY)","With the rapid development of big data and AI technology, programming is in high demand and has become an essential skill for students. Meanwhile, researchers also focus on boosting the online judging system's guidance ability to reduce students' dropout rates. Previous studies mainly targeted at enhancing learner engagement on online platforms by providing personalized recommendations. However, two significant challenges still need to be addressed in programming: C1) how to recognize complex programming behaviors; C2) how to capture intrinsic learning patterns that align with the actual learning process. To fill these gaps, in this paper, we propose a novel model called Programming Exercise Recommender with Learning Style (PERS), which simulates learners' intricate programming behaviors. Specifically, since programming is an iterative and trial-and-error process, we first introduce a positional encoding and a differentiating module to capture the changes of consecutive code submissions (which addresses C1). To better profile programming behaviors, we extend the Felder-Silverman learning style model, a classical pedagogical theory, to perceive intrinsic programming patterns. Based on this, we align three latent vectors to record and update programming ability, processing style, and understanding style, respectively (which addresses C2). We perform extensive experiments on two real-world datasets to verify the rationality of modeling programming learning styles and the effectiveness of PERS for personalized programming guidance.","Tue, 20 Feb 2024 10:38:38 UTC (1,063 KB)"
"17","Designing Robust Linear Output Feedback Controller based on CLF-CBF framework via Linear~Programming(LP-CLF-CBF)","Mahroo Bahreinian, Mehdi Kermanshah, Roberto Tron","Systems and Control (eess.SY)","We consider the problem of designing output feedback controllers that use measurements from a set of landmarks to navigate through a cell-decomposable environment using duality, Control Lyapunov and Barrier Functions (CLF, CBF), and Linear Programming. We propose two objectives for navigating in an environment, one to traverse the environment by making loops and one by converging to a stabilization point while smoothing the transition between consecutive cells. We test our algorithms in a simulation environment, evaluating the robustness of the approach to practical conditions, such as bearing-only measurements, and measurements acquired with a camera with a limited field of view.","Thu, 21 Mar 2024 16:17:39 UTC (4,486 KB)"
