"","Title","Author","Subject","Abstract","Meta"
"68","Early Planet Formation in Embedded Disks (eDisk) XIII: Aligned Disks with Non-Settled Dust Around the Newly Resolved Class 0 Protobinary R CrA IRAS 32","Frankie J. Encalada, Leslie W. Looney, Shigehisa Takakuwa, John J. Tobin, Nagayoshi Ohashi, Jes K. Jørgensen, Zhi-Yun Li, Yuri Aikawa, Yusuke Aso, Patrick M. Koch, Woojin Kwon, Shih-Ping Lai, Chang Won Lee, Zhe-Yu Daniel Lin, Alejandro Santamarıa-Miranda, Itziar de Gregorio-Monsalvo, Nguyen Thi Phuong, Adele Plunkett, Jinshi Sai (Insa Choi), Rajeeb Sharma, Hsi-Wei Yen, Ilseung Han","Solar and Stellar Astrophysics (astro-ph.SR)","Young protostellar binary systems, with expected ages less than $\sim$10$^5$ years, are little modified since birth, providing key clues to binary formation and evolution. We present a first look at the young, Class 0 binary protostellar system R CrA IRAS 32 from the Early Planet Formation in Embedded Disks (eDisk) ALMA large program, which observed the system in the 1.3 mm continuum emission, $^{12}$CO (2-1), $^{13}$CO (2-1), C$^{18}$O (2-1), SO (6$_5$-5$_4$), and nine other molecular lines that trace disk, envelope, shocks, and outflows. With a continuum resolution of $\sim$0.03$^{\prime\prime}$ ($\sim$5 au, at a distance of 150 pc), we characterize the newly discovered binary system with a separation of 207 au, their circumstellar disks, and a circumbinary disk-like structure. The circumstellar disk radii are 26.9$\pm$0.3 and 22.8$\pm$0.3 au for sources A and B, respectively, and their circumstellar disk dust masses are estimated as 22.5$\pm$1.1 and 12.4$\pm$0.6 M$_{\Earth}$. The circumstellar disks and the circumbinary structure have well aligned position angles and inclinations, indicating formation in a smooth, ordered process such as disk fragmentation. In addition, the circumstellar disks have a near/far-side asymmetry in the continuum emission suggesting that the dust has yet to settle into a thin layer near the midplane. Spectral analysis of CO isotopologues reveals outflows that originate from both of the sources and possibly from the circumbinary disk-like structure. Furthermore, we detect Keplerian rotation in the $^{13}$CO isotopologues toward both circumstellar disks and likely Keplerian rotation in the circumbinary structure; the latter suggests that it is probably a circumbinary disk.","Thu, 21 Mar 2024 05:39:58 UTC (42,542 KB)"
"69","Can ChatGPT Detect DeepFakes? A Study of Using Multimodal Large Language Models for Media Forensics","Shan Jia, Reilin Lyu, Kangran Zhao, Yize Chen, Zhiyuan Yan, Yan Ju, Chuanbo Hu, Xin Li, Baoyuan Wu, Siwei Lyu","Artificial Intelligence (cs.AI)","DeepFakes, which refer to AI-generated media content, have become an increasing concern due to their use as a means for disinformation. Detecting DeepFakes is currently solved with programmed machine learning algorithms. In this work, we investigate the capabilities of multimodal large language models (LLMs) in DeepFake detection. We conducted qualitative and quantitative experiments to demonstrate multimodal LLMs and show that they can expose AI-generated images through careful experimental design and prompt engineering. This is interesting, considering that LLMs are not inherently tailored for media forensic tasks, and the process does not require programming. We discuss the limitations of multimodal LLMs for these tasks and suggest possible improvements.","Thu, 21 Mar 2024 01:57:30 UTC (34,762 KB)"
"70","Real groups, symmetric varieties and Langlands duality","Tsao-Hsien Chen, David Nadler","Representation Theory (math.RT)","Let $G_\mathbb R$ be a connected real reductive group and let $X$ be the corresponding complex symmetric variety under the Cartan bijection. We construct a canonical equivalence between the relative Satake category of $G(\mathcal O)$-equivariant $\mathbb C$-constructible complexes on the loop space of $X$ and the real Satake category of $G_\mathbb R(\mathcal O_\mathbb R)$-equivariant $\mathbb C$-constructible complexes on the real affine Grassmannian. We show that the equivalence is $t$-exact with respect to the natural perverse $t$-structures and is compatible with the fusion products and Hecke actions. We further show that the relative Satake category is equivalent to the category of $\mathbb C$-constructible complexes on the moduli stack of $G_\mathbb R$-bundles on the real projective line $\mathbb P^1(\mathbb R)$ and hence provides a connection between the relative Langlands program and the geometric Langlands program for real groups. We provide numerous applications of the main theorems to real and relative Langlands duality including the formality and commutativity conjectures for the real and relative Satake categories and an identification of the dual groups for $G_\mathbb R$ and $X$.","Wed, 20 Mar 2024 21:51:20 UTC (81 KB)"
"71","depyf: Open the Opaque Box of PyTorch Compiler for Machine Learning Researchers","Kaichao You, Runsheng Bai, Meng Cao, Jianmin Wang, Ion Stoica, Mingsheng Long","Machine Learning (cs.LG)","PyTorch \texttt{2.x} introduces a compiler designed to accelerate deep learning programs. However, for machine learning researchers, adapting to the PyTorch compiler to full potential can be challenging. The compiler operates at the Python bytecode level, making it appear as an opaque box. To address this, we introduce \texttt{depyf}, a tool designed to demystify the inner workings of the PyTorch compiler. \texttt{depyf} decompiles bytecode generated by PyTorch back into equivalent source code, and establishes connections between in-memory code objects and their on-disk source code counterparts. This feature enables users to step through the source code line by line using debuggers, thus enhancing their understanding of the underlying processes. Notably, \texttt{depyf} is non-intrusive and user-friendly, primarily relying on two convenient context managers for its core functionality. The project is \href{this https URL}{ openly available} and is recognized as a \href{this https URL}{PyTorch ecosystem project}.","Thu, 14 Mar 2024 16:17:14 UTC (276 KB)"
"72","Taming Differentiable Logics with Coq Formalisation","Reynald Affeldt, Alessandro Bruni, Ekaterina Komendantskaya, Natalia Ślusarz, Kathrin Stark","Logic in Computer Science (cs.LO)","For performance and verification in machine learning, new methods have recently been proposed that optimise learning systems to satisfy formally expressed logical properties. Among these methods, differentiable logics (DLs) are used to translate propositional or first-order formulae into loss functions deployed for optimisation in machine learning. At the same time, recent attempts to give programming language support for verification of neural networks showed that DLs can be used to compile verification properties to machine-learning backends. This situation is calling for stronger guarantees about the soundness of such compilers, the soundness and compositionality of DLs, and the differentiability and performance of the resulting loss functions. In this paper, we propose an approach to formalise existing DLs using the Mathematical Components library in the Coq proof assistant. Thanks to this formalisation, we are able to give uniform semantics to otherwise disparate DLs, give formal proofs to existing informal arguments, find errors in previous work, and provide formal proofs to missing conjectured properties. This work is meant as a stepping stone for the development of programming language support for verification of machine learning.","Wed, 20 Mar 2024 16:04:57 UTC (248 KB)"
"73","Tensor Quantum Programming","A. Termanova, Ar. Melnikov, E. Mamenchikov, N. Belokonev, S. Dolgov, A. Berezutskii, R. Ellerbrock, C. Mansell, M. Perelshtein","Quantum Physics (quant-ph)","Running quantum algorithms often involves implementing complex quantum circuits with such a large number of multi-qubit gates that the challenge of tackling practical applications appears daunting. To date, no experiments have successfully demonstrated a quantum advantage due to the ease with which the results can be adequately replicated on classical computers through the use of tensor network algorithms. Additionally, it remains unclear even in theory where exactly these advantages are rooted within quantum systems because the logarithmic complexity commonly associated with quantum algorithms is also present in algorithms based on tensor networks. In this article, we propose a novel approach called Tensor Quantum Programming, which leverages tensor networks for hybrid quantum computing. Our key insight is that the primary challenge of algorithms based on tensor networks lies in their high ranks (bond dimensions). Quantum computing offers a potential solution to this challenge, as an ideal quantum computer can represent tensors with arbitrarily high ranks in contrast to classical counterparts, which indicates the way towards quantum advantage. While tensor-based vector-encoding and state-readout are known procedures, the matrix-encoding required for performing matrix-vector multiplications directly on quantum devices remained unsolved. Here, we developed an algorithm that encodes Matrix Product Operators into quantum circuits with a depth that depends linearly on the number of qubits. It demonstrates effectiveness on up to 50 qubits for several matrices frequently encountered in differential equations, optimization problems, and quantum chemistry. We view this work as an initial stride towards the creation of genuinely practical quantum algorithms.","Wed, 20 Mar 2024 10:44:00 UTC (991 KB)"
"74","Regent based parallel meshfree LSKUM solver for heterogenous HPC platforms","Sanath Salil, Nischay Ram Mamidi, Anil Nemili, Elliott Slaughter","Distributed, Parallel, and Cluster Computing (cs.DC)","Regent is an implicitly parallel programming language that allows the development of a single codebase for heterogeneous platforms targeting CPUs and GPUs. This paper presents the development of a parallel meshfree solver in Regent for two-dimensional inviscid compressible flows. The meshfree solver is based on the least squares kinetic upwind method. Example codes are presented to show the difference between the Regent and CUDA-C implementations of the meshfree solver on a GPU node. For CPU parallel computations, details are presented on how the data communication and synchronisation are handled by Regent and Fortran+MPI codes. The Regent solver is verified by applying it to the standard test cases for inviscid flows. Benchmark simulations are performed on coarse to very fine point distributions to assess the solver's performance. The computational efficiency of the Regent solver on an A100 GPU is compared with an equivalent meshfree solver written in CUDA-C. The codes are then profiled to investigate the differences in their performance. The performance of the Regent solver on CPU cores is compared with an equivalent explicitly parallel Fortran meshfree solver based on MPI. Scalability results are shown to offer insights into performance.","Wed, 20 Mar 2024 03:59:10 UTC (6,068 KB)"
"75","C Analyzer : A Static Program Analysis Tool for C Programs","Rajendra Kumar Solanki","Programming Languages (cs.PL)","In our times, when the world is increasingly becoming more dependent on software programs, writing bug-free, correct programs is crucial. Program verification based on formal methods can guarantee this by detecting run-time errors in safety-critical systems to avoid possible adverse impacts on human life and save time and money.
This project work tries to leverage Abstract Interpretation techniques for static analysis of C programs. C Analyzer is a tool developed for static analysis of C programs. This implementation of C Analyzer provides a plug-and-play domain architecture for multiple abstract domains to be used. C Analyzer supports four abstract domains - Interval, Octagon, Polyhedra, and Bit Vector. We use these different domains for required precision in program verification. C Analyzer tool uses LLVM C/C++ compiler frontend Clang API to generate and traverse the Control Flow Graph (CFG) of a given C program. This tool generates invariants in different abstract domains for statements in basic blocks of CFG during CFG traversal. Using these invariants, some properties of a program, such as dividing by zero, modulus zero, arithmetic overflow, etc., can be analyzed. We also use a source-to-source transformation tool, CIL (Common Intermediate language), to transform some C constructs into simpler constructs, such as transforming logical operators, switch statements, and conditional operators into if-else ladders and transforming do-while and for loops into while loops.
Using C Analyzer, C program constructs such as declarations, assignments, binary operations (arithmetic, relational, bitwise shift, etc.), conditions (if-else), loops (while, do while, for loop), nested conditions, and nested loops can be analyzed. Currently, this tool does not support arrays, structures, unions, pointers, or function calls.","Sun, 28 Jan 2024 11:43:16 UTC (2,384 KB)"
"76","Navigating Compiler Errors with AI Assistance -- A Study of GPT Hints in an Introductory Programming Course","Maciej Pankiewicz, Ryan S. Baker","Software Engineering (cs.SE)","We examined the efficacy of AI-assisted learning in an introductory programming course at the university level by using a GPT-4 model to generate personalized hints for compiler errors within a platform for automated assessment of programming assignments. The control group had no access to GPT hints. In the experimental condition GPT hints were provided when a compiler error was detected, for the first half of the problems in each module. For the latter half of the module, hints were disabled. Students highly rated the usefulness of GPT hints. In affect surveys, the experimental group reported significantly higher levels of focus and lower levels of confrustion (confusion and frustration) than the control group. For the six most commonly occurring error types we observed mixed results in terms of performance when access to GPT hints was enabled for the experimental group. However, in the absence of GPT hints, the experimental group's performance surpassed the control group for five out of the six error types.","Tue, 19 Mar 2024 13:54:14 UTC (431 KB)"
"77","Prototipo de video juego activo basado en una cámara 3D para motivar la actividad física en niños y adultos mayores","Benjamín Ojeda Magaña, José Guadalupe Robledo Hernández, Leopoldo Gómez Barba, Victor Manuel Rangel Cobián","Human-Computer Interaction (cs.HC)","This document describes the development of a video game prototype designed to encourage physical activity among children and older adults. The prototype consists of a laptop, a camera with 3D sensors, and optionally requires an LCD screen or a projector. The programming component of this prototype was developed in Scratch, a programming language geared towards children, which greatly facilitates the creation of a game tailored to the users' preferences. The idea to create such a prototype originated from the desire to offer an option that promotes physical activity among children and adults, given that a lack of physical exercise is a predominant factor in the development of chronic degenerative diseases such as diabetes and hypertension, to name the most common. As a result of this initiative, an active video game prototype was successfully developed, based on a ping-pong game, which allows both children and adults to interact in a fun way while encouraging the performance of physical activities that can positively impact the users' health.","Tue, 19 Mar 2024 04:44:09 UTC (1,324 KB)"
"78","IKSPARK: An Inverse Kinematics Solver using Semidefinite Relaxation and Rank Minimization","Liangting Wu, Roberto Tron","Robotics (cs.RO)","Inverse kinematics (IK) is a fundamental problem frequently occurred in robot control and motion planning. However, the problem is nonconvex because the kinematic map between the configuration and task spaces is generally nonlinear, which makes it challenging for fast and accurate solutions. The problem can be more complicated with the existence of different physical constraints imposed by the robot structure. In this paper, we develop an inverse kinematics solver named IKSPARK (Inverse Kinematics using Semidefinite Programming And RanK minimization) that can find solutions for robots with various structures, including open/closed kinematic chains, spherical, revolute, and/or prismatic joints. The solver works in the space of rotation matrices of the link reference frames and involves solving only convex semidefinite problems (SDPs). Specifically, the IK problem is formulated as an SDP with an additional rank-1 constraint on symmetric matrices with constant traces. The solver first solves this SDP disregarding the rank constraint to get a start point and then finds the rank-1 solution iteratively via a rank minimization algorithm with proven local convergence. Compared to other work that performs SDP relaxation for IK problems, our formulation is simpler, and uses variables with smaller sizes. We validate our approach via simulations on different robots, comparing against a standard IK method.","Mon, 18 Mar 2024 20:33:06 UTC (1,102 KB)"
"79","Routing and Scheduling in Answer Set Programming applied to Multi-Agent Path Finding: Preliminary Report","Roland Kaminski, Torsten Schaub, Tran Cao Son, Jiří Švancara, Philipp Wanko","Artificial Intelligence (cs.AI)","We present alternative approaches to routing and scheduling in Answer Set Programming (ASP), and explore them in the context of Multi-agent Path Finding. The idea is to capture the flow of time in terms of partial orders rather than time steps attached to actions and fluents. This also abolishes the need for fixed upper bounds on the length of plans. The trade-off for this avoidance is that (parts of) temporal trajectories must be acyclic, since multiple occurrences of the same action or fluent cannot be distinguished anymore. While this approach provides an interesting alternative for modeling routing, it is without alternative for scheduling since fine-grained timings cannot be represented in ASP in a feasible way. This is different for partial orders that can be efficiently handled by external means such as acyclicity and difference constraints. We formally elaborate upon this idea and present several resulting ASP encodings. Finally, we demonstrate their effectiveness via an empirical analysis.","Mon, 18 Mar 2024 18:09:47 UTC (350 KB)"
"80","Semidefinite programming on population clustering: a local analysis","Shuheng Zhou","Statistics Theory (math.ST)","In this paper, we consider the problem of partitioning a small data sample of size $n$ drawn from a mixture of $2$ sub-gaussian distributions. In particular, we design and analyze two computational efficient algorithms to partition data into two groups approximately according to their population of origin given a small sample in a recent paper (Zhou 2023a). Our work is motivated by the application of clustering individuals according to their population of origin using markers, when the divergence between any two of the populations is small. Moreover, we are interested in the case that individual features are of low average quality $\gamma$, and we want to use as few of them as possible to correctly partition the sample. Here we use $p \gamma$ to denote the $\ell_2^2$ distance between two population centers (mean vectors), namely, $\mu^{(1)}$, $\mu^{(2)}$ $\in$ ${\mathbb R}^p$. We allow a full range of tradeoffs between $n, p, \gamma$ in the sense that partial recovery (success rate $< 100\%$) is feasible once the signal to noise ratio $s^2 := \min\{np \gamma^2, p \gamma\}$ is lower bounded by a constant. Our work builds upon the semidefinite relaxation of an integer quadratic program that is formulated essentially as finding the maximum cut on a graph, where edge weights in the cut represent dissimilarity scores between two nodes based on their $p$ features in Zhou (2023a). More importantly, we prove that the misclassification error decays exponentially with respect to the SNR $s^2$ in the present paper. The significance of such an exponentially decaying error bound is: when $s^2 =\Omega(\log n)$, perfect recovery of the cluster structure is accomplished. This result was introduced in Zhou (2023a) without a proof. We therefore present the full proof in the present work.","Thu, 23 Nov 2023 16:03:28 UTC (120 KB)"
"81","Beamforming Design for Semantic-Bit Coexisting Communication System","Maojun Zhang, Guangxu Zhu, Richeng Jin, Xiaoming Chen, Qingjiang Shi, Caijun Zhong, Kaibin Huang","Information Theory (cs.IT)","Semantic communication (SemCom) is emerging as a key technology for future sixth-generation (6G) systems. Unlike traditional bit-level communication (BitCom), SemCom directly optimizes performance at the semantic level, leading to superior communication efficiency. Nevertheless, the task-oriented nature of SemCom renders it challenging to completely replace BitCom. Consequently, it is desired to consider a semantic-bit coexisting communication system, where a base station (BS) serves SemCom users (sem-users) and BitCom users (bit-users) simultaneously. Such a system faces severe and heterogeneous inter-user interference. In this context, this paper provides a new semantic-bit coexisting communication framework and proposes a spatial beamforming scheme to accommodate both types of users. Specifically, we consider maximizing the semantic rate for semantic users while ensuring the quality-of-service (QoS) requirements for bit-users. Due to the intractability of obtaining the exact closed-form expression of the semantic rate, a data driven method is first applied to attain an approximated expression via data fitting. With the resulting complex transcendental function, majorization minimization (MM) is adopted to convert the original formulated problem into a multiple-ratio problem, which allows fractional programming (FP) to be used to further transform the problem into an inhomogeneous quadratically constrained quadratic programs (QCQP) problem. Solving the problem leads to a semi-closed form solution with undetermined Lagrangian factors that can be updated by a fixed point algorithm. Extensive simulation results demonstrate that the proposed beamforming scheme significantly outperforms conventional beamforming algorithms such as zero-forcing (ZF), maximum ratio transmission (MRT), and weighted minimum mean-square error (WMMSE).","Mon, 18 Mar 2024 11:48:02 UTC (6,154 KB)[v2] Fri, 22 Mar 2024 21:54:33 UTC (6,154 KB)"
"82","LOOPer: A Learned Automatic Code Optimizer For Polyhedral Compilers","Massinissa Merouani, Khaled Afif Boudaoud, Iheb Nassim Aouadj, Nassim Tchoulak, Islem Kara Bernou, Hamza Benyamina, Fatima Benbouzid-Si Tayeb, Karima Benatchba, Hugh Leather, Riyadh Baghdadi","Programming Languages (cs.PL)","While polyhedral compilers have shown success in implementing advanced code transformations, they still have challenges in selecting the most profitable transformations that lead to the best speedups. This has motivated the use of machine learning to build cost models to guide the search for polyhedral optimizations. State-of-the-art polyhedral compilers have demonstrated a viable proof-of-concept of this approach. While such a proof-of-concept has shown promise, it still has significant limitations. State-of-the-art polyhedral compilers that use a deep-learning cost model only support a small subset of affine transformations, limiting their ability to apply complex code transformations. They also only support simple programs that have a single loop nest and a rectangular iteration domain, limiting their applicability to many programs. These limitations significantly impact the generality of such compilers and autoschedulers and put into question the whole approach. In this paper, we introduce LOOPer, the first polyhedral autoscheduler that uses a deep-learning based cost model and covers a large set of affine transformations and programs. It supports the exploration of a large set of affine transformations, allowing the application of complex sequences of polyhedral transformations. It also supports the optimization of programs with multiple loop nests and with rectangular and non-rectangular iteration domains, allowing the optimization of an extensive set of programs. We implement and evaluate LOOPer and show that it achieves speedups over the state-of-the-art. On the Polybench benchmark, LOOPer achieves a geometric mean speedup of 1.59x over Tiramisu. LOOPer also achieves competitive speedups with a geometric mean speedup of 1.34x over Pluto, a state-of-the-art polyhedral compiler that does not use a machine-learning based cost model.","Mon, 18 Mar 2024 07:22:31 UTC (1,073 KB)[v2] Fri, 22 Mar 2024 10:28:05 UTC (1,073 KB)"
