"","Title","Author","Subject","Abstract","Meta"
"33","Table-Lookup MAC: Scalable Processing of Quantised Neural Networks in FPGA Soft Logic","Daniel Gerlinghoff, Benjamin Chen Ming Choong, Rick Siow Mong Goh, Weng-Fai Wong, Tao Luo","Hardware Architecture (cs.AR)","Recent advancements in neural network quantisation have yielded remarkable outcomes, with three-bit networks reaching state-of-the-art full-precision accuracy in complex tasks. These achievements present valuable opportunities for accelerating neural networks by computing in reduced precision. Implementing it on FPGAs can take advantage of bit-level reconfigurability, which is not available on conventional CPUs and GPUs. Simultaneously, the high data intensity of neural network processing has inspired computing-in-memory paradigms, including on FPGA platforms. By programming the effects of trained model weights as lookup operations in soft logic, the transfer of weight data from memory units can be avoided, alleviating the memory bottleneck. However, previous methods face poor scalability - the high logic utilisation limiting them to small networks/sub-networks of binary models with low accuracy. In this paper, we introduce Table Lookup Multiply-Accumulate (TLMAC) as a framework to compile and optimise quantised neural networks for scalable lookup-based processing. TLMAC clusters and maps unique groups of weights to lookup-based processing elements, enabling highly parallel computation while taking advantage of parameter redundancy. Further place and route algorithms are proposed to reduce LUT utilisation and routing congestion. We demonstrate that TLMAC significantly improves the scalability of previous related works. Our efficient logic mapping and high degree of reuse enables entire ImageNet-scale quantised models with full-precision accuracy to be implemented using lookup-based computing on one commercially available FPGA.","Mon, 18 Mar 2024 02:03:23 UTC (757 KB)"
"34","Multiscale Quantile Regression with Local Error Control","Zhi Liu, Housen Li","Methodology (stat.ME)","For robust and efficient detection of change points, we introduce a novel methodology MUSCLE (multiscale quantile segmentation controlling local error) that partitions serial data into multiple segments, each sharing a common quantile. It leverages multiple tests for quantile changes over different scales and locations, and variational estimation. Unlike the often adopted global error control, MUSCLE focuses on local errors defined on individual segments, significantly improving detection power in finding change points. Meanwhile, due to the built-in model complexity penalty, it enjoys the finite sample guarantee that its false discovery rate (or the expected proportion of falsely detected change points) is upper bounded by its unique tuning parameter. Further, we obtain the consistency and the localisation error rates in estimating change points, under mild signal-to-noise-ratio conditions. Both match (up to log factors) the minimax optimality results in the Gaussian setup. All theories hold under the only distributional assumption of serial independence. Incorporating the wavelet tree data structure, we develop an efficient dynamic programming algorithm for computing MUSCLE. Extensive simulations as well as real data applications in electrophysiology and geophysics demonstrate its competitiveness and effectiveness. An implementation via R package muscle is available from GitHub.","Sun, 17 Mar 2024 22:12:48 UTC (2,408 KB)"
"35","Frequency-Reactive Power Optimization Strategy of Grid-forming Offshore Wind Farm Using DRU-HVDC Transmission","Zhekai Li, Kun Han, Xu Cai, Renxin Yang, Haotian Yu, Kepeng Xia, Lulu Liu","Optimization and Control (math.OC)","The diode rectifier unit-based high voltage direct current (DRU-HVDC) transmission with grid-forming (GFM) wind turbine is becoming a promising scheme for offshore wind farm(OWF) integration due to its high reliability and low cost. In this scheme, the AC network of the OWF and the DRU has completely different synchronization mechanisms and power flow characteristics from the traditional power system. To optimize the power flow and reduce the net loss, this paper carries out the power flow modeling and optimization analysis for the DRU-HVDC transmission system with grid-forming OWFs. The influence of the DRU and the GFM wind turbines on the power flow of the system is analyzed. On this basis, improved constraint conditions are proposed and an optimal power flow (OPF) method is established. This method can minimize the power loss by adjusting the reactive power output of each wind turbine and internal network frequency. Finally, based on MATLAB, this paper uses YALMIP toolkit and CPLEX mathematical solver to realize the programming solution of the OPF model proposed in this paper. The results show that the proposed optimization strategy can effectively reduce the power loss of the entire OWF and the transmission system with an optimization ratio of network losses exceeding 25.3%.","Sat, 16 Mar 2024 04:01:18 UTC (17,794 KB)"
"36","Mitigation and optimization of induced seismicity using physics-based forecasting","Ryley G Hill, Matthew Weingarten, Cornelius Langenbruch, Yuri Fialko","Geophysics (physics.geo-ph)","Fluid injection can induce seismicity by altering stresses on pre-existing faults. Here, we investigate minimizing induced seismic hazard by optimizing injection operations in a physics-based forecasting framework. We built a 3D finite element model of the poroelastic crust for the Raton Basin, Central US, and used it to estimate time dependent Coulomb stress changes due to ~25 years of wastewater injection in the region. Our finite element model is complemented by a statistical analysis of the seismogenic index (SI), a proxy for critically stressed faults affected by variations in the pore pressure. Forecasts of seismicity rate from our hybrid physics-based statistical model suggest that induced seismicity in the Raton Basin, from 2001 - 2022, is still driven by wastewater injection. Our model suggests that pore pressure diffusion is the dominant cause of Coulomb stress changes at seismogenic depth, with poroelastic stress changes contributing about 5% to the driving force. Linear programming optimization for the Raton Basin reveals that it is feasible to reduce seismic hazard for a given amount of injected fluid (safety objective) or maximize fluid injection for a prescribed seismic hazard (economic objective). The optimization tends to spread out high-rate injectors and shift them to regions of lower SI. The framework has practical importance as a tool to manage injection rate per unit field area to reduce induced seismic hazard. Our optimization framework is both flexible and adaptable to mitigate induced seismic hazard in other regions and for other types of subsurface fluid injection.","Fri, 15 Mar 2024 20:49:44 UTC (24,859 KB)"
"37","Unsupervised Threat Hunting using Continuous Bag-of-Terms-and-Time (CBoTT)","Varol Kayhan, Shivendu Shivendu, Rouzbeh Behnia, Clinton Daniel, Manish Agrawal","Cryptography and Security (cs.CR)","Threat hunting is sifting through system logs to detect malicious activities that might have bypassed existing security measures. It can be performed in several ways, one of which is based on detecting anomalies. We propose an unsupervised framework, called continuous bag-of-terms-and-time (CBoTT), and publish its application programming interface (API) to help researchers and cybersecurity analysts perform anomaly-based threat hunting among SIEM logs geared toward process auditing on endpoint devices. Analyses show that our framework consistently outperforms benchmark approaches. When logs are sorted by likelihood of being an anomaly (from most likely to least), our approach identifies anomalies at higher percentiles (between 1.82-6.46) while benchmark approaches identify the same anomalies at lower percentiles (between 3.25-80.92). This framework can be used by other researchers to conduct benchmark analyses and cybersecurity analysts to find anomalies in SIEM logs.","Fri, 15 Mar 2024 14:16:10 UTC (583 KB)"
"38","LyZNet: A Lightweight Python Tool for Learning and Verifying Neural Lyapunov Functions and Regions of Attraction","Jun Liu, Yiming Meng, Maxwell Fitzsimmons, Ruikun Zhou","Systems and Control (eess.SY)","In this paper, we describe a lightweight Python framework that provides integrated learning and verification of neural Lyapunov functions for stability analysis. The proposed tool, named LyZNet, learns neural Lyapunov functions using physics-informed neural networks (PINNs) to solve Zubov's equation and verifies them using satisfiability modulo theories (SMT) solvers. What distinguishes this tool from others in the literature is its ability to provide verified regions of attraction close to the domain of attraction. This is achieved by encoding Zubov's partial differential equation (PDE) into the PINN approach. By embracing the non-convex nature of the underlying optimization problems, we demonstrate that in cases where convex optimization, such as semidefinite programming, fails to capture the domain of attraction, our neural network framework proves more successful. The tool also offers automatic decomposition of coupled nonlinear systems into a network of low-dimensional subsystems for compositional verification. We illustrate the tool's usage and effectiveness with several numerical examples, including both non-trivial low-dimensional nonlinear systems and high-dimensional systems. The repository of the tool can be found at this https URL.","Fri, 15 Mar 2024 04:35:56 UTC (1,183 KB)"
"39","Compositionally Verifiable Vector Neural Lyapunov Functions for Stability Analysis of Interconnected Nonlinear Systems","Jun Liu, Yiming Meng, Maxwell Fitzsimmons, Ruikun Zhou","Systems and Control (eess.SY)","While there has been increasing interest in using neural networks to compute Lyapunov functions, verifying that these functions satisfy the Lyapunov conditions and certifying stability regions remain challenging due to the curse of dimensionality. In this paper, we demonstrate that by leveraging the compositional structure of interconnected nonlinear systems, it is possible to verify neural Lyapunov functions for high-dimensional systems beyond the capabilities of current satisfiability modulo theories (SMT) solvers using a monolithic approach. Our numerical examples employ neural Lyapunov functions trained by solving Zubov's partial differential equation (PDE), which characterizes the domain of attraction for individual subsystems. These examples show a performance advantage over sums-of-squares (SOS) polynomial Lyapunov functions derived from semidefinite programming.","Fri, 15 Mar 2024 04:19:32 UTC (264 KB)"
"40","One-shot Learning for MIPs with SOS1 Constraints","Charly Robinson La Rocca, Jean-François Cordeau, Emma Frejinger","Optimization and Control (math.OC)","Efficient algorithms and solvers are required to provide optimal or near-optimal solutions quickly and enable organizations to react promptly to dynamic situations such as supply chain disruptions or changing customer demands. State-of-the-art mixed-integer programming (MIP) solvers are crafted to tackle a wide variety of problems, yet many real-world situations are characterized by problem instances that originate from a narrow distribution. This has inspired the creation of tailored approaches that exploit historical data to inform heuristic design. Deep learning (DL) methods are typically used in this context to extract patterns from data, but they require large datasets and comprehensive hyperparameter tuning for strong performance. This article describes a one-shot learning heuristic that leverages solutions discovered within the branch-and-bound tree to construct a model with minimal overhead. We evaluate our method on the locomotive assignment problem (LAP) and sets of MIPLIB instances that contain constraints based on special ordered sets of type 1. Experimental results include a comparison with multiple primal heuristics and state-of-the-art MIP solvers. We show that the method is most effective with CPLEX in terms of the average primal gap.","Thu, 14 Mar 2024 19:08:26 UTC (58 KB)"
"41","Teaching Machines to Code: Smart Contract Translation with LLMs","Rabimba Karanjai, Lei Xu, Weidong Shi","Software Engineering (cs.SE)","The advent of large language models (LLMs) has marked a significant milestone in the realm of artificial intelligence, with their capabilities often matching or surpassing human expertise in various domains. Among these achievements, their adeptness in translation tasks stands out, closely mimicking the intricate and preliminary processes undertaken by human translators to ensure the fidelity and quality of the translated content. Despite the advancements in utilizing LLMs for translating programming code across different languages, the domain of smart contract translation, particularly into languages not previously encountered by the LLM, remains largely unexplored. In our research, we present a pioneering approach, SolMover, which harnesses the synergy of two distinct LLMs within a unified framework. This framework is designed to grasp coding principles and apply this understanding to the translation of code into an unfamiliar language. Our study delves into the capacity of LLMs to mimic human learning processes, offering an in-depth evaluation of our methodology for converting smart contracts written in Solidity to Move, a language with limited resources. The framework employs one LLM to decipher coding conventions for the new language, creating a blueprint for the second LLM, which, lacking planning abilities, possesses coding expertise. The empirical evidence from our experiments suggests that SolMover substantially enhances performance compared to gpt-3.5-turbo-1106, and achieves superior results over competitors such as Palm2 and Mixtral-8x7B-Instruct. Additionally, our analysis highlights the efficacy of our bug mitigation strategy in elevating code quality across all models, even outside the SolMover framework.","Wed, 13 Mar 2024 18:55:20 UTC (1,020 KB)"
"42","CoRaiS: Lightweight Real-Time Scheduler for Multi-Edge Cooperative Computing","Yujiao Hu, Qingmin Jia, Jinchao Chen, Yuan Yao, Yan Pan, Renchao Xie, F.Richard Yu","Distributed, Parallel, and Cluster Computing (cs.DC)","Multi-edge cooperative computing that combines constrained resources of multiple edges into a powerful resource pool has the potential to deliver great benefits, such as a tremendous computing power, improved response time, more diversified services. However, the mass heterogeneous resources composition and lack of scheduling strategies make the modeling and cooperating of multi-edge computing system particularly complicated. This paper first proposes a system-level state evaluation model to shield the complex hardware configurations and redefine the different service capabilities at heterogeneous edges. Secondly, an integer linear programming model is designed to cater for optimally dispatching the distributed arriving requests. Finally, a learning-based lightweight real-time scheduler, CoRaiS, is proposed. CoRaiS embeds the real-time states of multi-edge system and requests information, and combines the embeddings with a policy network to schedule the requests, so that the response time of all requests can be minimized. Evaluation results verify that CoRaiS can make a high-quality scheduling decision in real time, and can be generalized to other multi-edge computing system, regardless of system scales. Characteristic validation also demonstrates that CoRaiS successfully learns to balance loads, perceive real-time state and recognize heterogeneity while scheduling.","Sun, 4 Feb 2024 07:21:45 UTC (10,928 KB)"
"43","Leveraging Constraint Programming in a Deep Learning Approach for Dynamically Solving the Flexible Job-Shop Scheduling Problem","Imanol Echeverria, Maialen Murua, Roberto Santana","Artificial Intelligence (cs.AI)","Recent advancements in the flexible job-shop scheduling problem (FJSSP) are primarily based on deep reinforcement learning (DRL) due to its ability to generate high-quality, real-time solutions. However, DRL approaches often fail to fully harness the strengths of existing techniques such as exact methods or constraint programming (CP), which can excel at finding optimal or near-optimal solutions for smaller instances. This paper aims to integrate CP within a deep learning (DL) based methodology, leveraging the benefits of both. In this paper, we introduce a method that involves training a DL model using optimal solutions generated by CP, ensuring the model learns from high-quality data, thereby eliminating the need for the extensive exploration typical in DRL and enhancing overall performance. Further, we integrate CP into our DL framework to jointly construct solutions, utilizing DL for the initial complex stages and transitioning to CP for optimal resolution as the problem is simplified. Our hybrid approach has been extensively tested on three public FJSSP benchmarks, demonstrating superior performance over five state-of-the-art DRL approaches and a widely-used CP solver. Additionally, with the objective of exploring the application to other combinatorial optimization problems, promising preliminary results are presented on applying our hybrid approach to the traveling salesman problem, combining an exact method with a well-known DRL method.","Thu, 14 Mar 2024 10:16:57 UTC (1,713 KB)"
"44","Quantum Dynamic Programming","Jeongrak Son, Marek Gluza, Ryuji Takagi, Nelly H. Y. Ng","Quantum Physics (quant-ph)","We introduce a quantum extension of dynamic programming, a fundamental computational method for efficiently solving recursive problems using memory. Our innovation lies in showing how to coherently generate unitaries of recursion steps using memorized intermediate quantum states. We find that quantum dynamic programming yields an exponential reduction in circuit depth for a large class of fixed-point quantum recursions, including a known recursive variant of the Grover's search. Additionally, we apply quantum dynamic programming to a recently proposed double-bracket quantum algorithm for diagonalization to obtain a new protocol for obliviously preparing a quantum state in its Schmidt basis, providing a potential pathway for revealing entanglement structures of unknown quantum states.","Thu, 14 Mar 2024 08:59:22 UTC (140 KB)"
"45","Formalizing Date Arithmetic and Statically Detecting Ambiguities for the Law","Raphaël Monat, Aymeric Fromherz, Denis Merigoux","Programming Languages (cs.PL)","Legal expert systems routinely rely on date computations to determine the eligibility of a citizen to social benefits or whether an application has been filed on time. Unfortunately, date arithmetic exhibits many corner cases, which are handled differently from one library to the other, making faithfully transcribing the law into code error-prone, and possibly leading to heavy financial and legal consequences for users. In this work, we aim to provide a solid foundation for date arithmetic working on days, months and years. We first present a novel, formal semantics for date computations, and formally establish several semantic properties through a mechanization in the F* proof assistant. Building upon this semantics, we then propose a static analysis by abstract interpretation to automatically detect ambiguities in date computations. We finally integrate our approach in the Catala language, a recent domain-specific language for formalizing computational law, and use it to analyze the Catala implementation of the French housing benefits, leading to the discovery of several date-related ambiguities.","Wed, 13 Mar 2024 20:05:09 UTC (59 KB)"
"46","Understanding and Evaluating Developer Behaviour in Programming Tasks","Martin Schröer, Rainer Koschke","Software Engineering (cs.SE)","To evaluate how developers perform differently in solving programming tasks, i.e., which actions and behaviours are more beneficial to them than others and if there are any specific strategies and behaviours that may indicate good versus poor understanding of the task and program given to them, we used the MIMESIS plug-in to record developers' interactions with the IDE. In a series of three studies we investigated the specific behaviour of developers solving a specific programming task. We focused on which source code files they visited, how they related pieces of code and knowledge to others and when and how successful they performed code edits. To cope with the variety of behaviours due to interpersonal differences such as different level of knowledge, development style or problem solving stratiegies, we used an abstraction of the observed behaviour, which enables for a better comparison between different individual attributes such as skill, speed and used stratiegies and also facilitates later automatic evaluation of behaviours, i.e. by using a software to react to.","Wed, 13 Mar 2024 12:46:42 UTC (161 KB)"
"47","User-Centric Beam Selection and Precoding Design for Coordinated Multiple-Satellite Systems","Vu Nguyen Ha, Duy H. N. Nguyen, Juan C.-M. Duncan, Jorge L. Gonzalez-Rios, Juan A. Vasquez, Geoffrey Eappen, Luis M. Garces-Socarras, Rakesh Palisetty, Symeon Chatzinotas, Bjorn Ottersten","Signal Processing (eess.SP)","This paper introduces a joint optimization framework for user-centric beam selection and linear precoding (LP) design in a coordinated multiple-satellite (CoMSat) system, employing a Digital-Fourier-Transform-based (DFT) beamforming (BF) technique. Regarding serving users at their target SINRs and minimizing the total transmit power, the scheme aims to efficiently determine satellites for users to associate with and activate the best cluster of beams together with optimizing LP for every satellite-to-user transmission. These technical objectives are first framed as a complex mixed-integer programming (MIP) challenge. To tackle this, we reformulate it into a joint cluster association and LP design problem. Then, by theoretically analyzing the duality relationship between downlink and uplink transmissions, we develop an efficient iterative method to identify the optimal solution. Additionally, a simpler duality approach for rapid beam selection and LP design is presented for comparison purposes. Simulation results underscore the effectiveness of our proposed schemes across various settings.","Wed, 13 Mar 2024 09:32:03 UTC (3,860 KB)"
"48","Mastering Text, Code and Math Simultaneously via Fusing Highly Specialized Language Models","Ning Ding, Yulin Chen, Ganqu Cui, Xingtai Lv, Weilin Zhao, Ruobing Xie, Bowen Zhou, Zhiyuan Liu, Maosong Sun","Computation and Language (cs.CL)","Underlying data distributions of natural language, programming code, and mathematical symbols vary vastly, presenting a complex challenge for large language models (LLMs) that strive to achieve high performance across all three domains simultaneously. Achieving a very high level of proficiency for an LLM within a specific domain often requires extensive training with relevant corpora, which is typically accompanied by a sacrifice in performance in other domains. In this paper, we propose to fuse models that are already highly-specialized directly. The proposed fusing framework, UltraFuser, consists of three distinct specialists that are already sufficiently trained on language, coding, and mathematics. A token-level gating mechanism is introduced to blend the specialists' outputs. A two-stage training strategy accompanied by balanced sampling is designed to ensure stability. To effectively train the fused model, we further construct a high-quality supervised instruction tuning dataset, UltraChat 2, which includes text, code, and mathematical content. This dataset comprises approximately 300,000 instructions and covers a wide range of topics in each domain. Experiments show that our model could simultaneously achieve mastery of the three crucial domains.","Wed, 13 Mar 2024 06:18:48 UTC (7,384 KB)[v2] Fri, 15 Mar 2024 07:22:31 UTC (7,386 KB)[v3] Mon, 18 Mar 2024 07:21:28 UTC (7,386 KB)"
"49","BayesFLo: Bayesian fault localization of complex software systems","Yi Ji, Simon Mak, Ryan Lekivetz, Joseph Morgan","Software Engineering (cs.SE)","Software testing is essential for the reliable development of complex software systems. A key step in software testing is fault localization, which uses test data to pinpoint failure-inducing combinations for further diagnosis. Existing fault localization methods, however, are largely deterministic, and thus do not provide a principled approach for assessing probabilistic risk of potential root causes, or for integrating domain and/or structural knowledge from test engineers. To address this, we propose a novel Bayesian fault localization framework called BayesFLo, which leverages a flexible Bayesian model on potential root cause combinations. A key feature of BayesFLo is its integration of the principles of combination hierarchy and heredity, which capture the structured nature of failure-inducing combinations. A critical challenge, however, is the sheer number of potential root cause scenarios to consider, which renders the computation of posterior root cause probabilities infeasible even for small software systems. We thus develop new algorithms for efficient computation of such probabilities, leveraging recent tools from integer programming and graph representations. We then demonstrate the effectiveness of BayesFLo over state-of-the-art fault localization methods, in a suite of numerical experiments and in two motivating case studies on the JMP XGBoost interface.","Tue, 12 Mar 2024 21:12:53 UTC (3,321 KB)"
